category,category_id,job_title,company,location,salary_range,skills_text,contract_type,date_posted,job_url,job_id
Consulting/Company Development,124,Expertin / Experte Arbeitssicherheit und Gesundheitsschutz (alle Geschlechter) 80 - 100 %,Suva,Luzern,CHF 85000 - 125000 (jobs.ch estimate),"Join Suva as an Expert in Occupational Safety and Health! This role offers a chance to make work safer for millions and grow your expertise. Tasks Advise and oversee companies on safety and health regulations. Create technical assessments on occupational diseases and accidents. Engage in interdisciplinary projects, especially on asbestos issues. Skills A degree in natural sciences or engineering is required. Experience in industrial settings or building materials. Fluency in German, with French and Italian as a plus. Stellenbeschreibung Mach dich mit uns stark. Bei uns weisst du genau, wofür du morgens aufstehst: Du machst Arbeit und Freizeit von Millionen Menschen sicherer. Das treibt dich an und bringt dich vorwärts. Du lernst täglich dazu und wächst daran. Zusammen mit uns. Expertin / Experte Arbeitssicherheit und Gesundheitsschutz (alle Geschlechter) 80-100% Luzern Was du bewirkst Als Fachperson berätst und kontrollierst du die bei der Suva versicherten Betriebe bezüglich Arbeitssicherheit und Gesundheitsschutz. Du erstellst technische Expertisen zu Berufskrankheiten und Berufsunfällen. In interdisziplinären Projekten bist du bereit dazu, dich im Themengebiet Asbest zu vertiefen und dein Wissen in Fachgremien einzubringen. Du erarbeitest Grundlagen für Informationsmittel und hilfst so aktiv Berufskrankheiten zu verhindern. Nach Möglichkeit übernimmst du auch Vortrags- und Lehrtätigkeiten. Was du mitbringst Du verfügst über ein Studium in Naturwissenschaften oder Ingenieurswesen. Dank deiner mehrjährigen Erfahrung im industriellen Umfeld oder im Bereich Bauschadstoffe kannst du deinen Standpunkt gegenüber unseren Kunden klar vertreten. Eine abgeschlossene Ausbildung im Bereich Arbeitssicherheit bringst du mit, oder bist bereit diese zu absolvieren. Du willst etwas bewirken und bringst dich mit deinen Ideen aktiv ins Team ein. Deutsch beherrschst du auf Muttersprachniveau, Französisch- und Italienischkenntnisse sind ein grosses Plus. Jetzt bewerben",On-site,2026-04-10T08:26:37+02:00,https://www.jobs.ch/en/vacancies/detail/e5db876d-279b-4fbf-8fd6-6f3ac55e573a/,e5db876d-279b-4fbf-8fd6-6f3ac55e573a
Consulting/Company Development,124,Leiter Umweltschutz und Sicherheit (m/w/d),EMS-CHEMIE AG,Domat/Ems,,"Leiter Umweltschutz und Sicherheit (m/w/d) Domat/Ems Was erwartet Sie Verantwortlich für die Umweltschutzbelange auf dem Werkplatz (Prävention, Einhaltung Vorschriften, Reporting, Auditierung, Schulung, etc.) Beratung, Ausbildung und Kontrolle auf dem Sektor des Umweltschutzes Kontakte zu Behörden, Verbänden und Industrie Sicherheitsfachmann für die Unternehmensbereiche am Standort Domat/Ems Beratung, Ausbildung und Kontrolle auf dem Sektor der Arbeitssicherheit Durchführen von Risikoanalysen, Arbeitsplatzgefährdungsbeurteilung und Audits Erfassung, Abklärung und Auswertung von Betriebs- und Nichtbetriebsunfällen Was bringen Sie mit Ausbildung zum Chemiker mit einigen Jahren Berufspraxis Erfahrung im Bereich Umweltschutz idealerweise in der chemischen oder kunstoffverarbeitenden Industrie Idealerweise Ausbildung zum Sicherheitsexperte (EKAS) Selbständige Arbeitsweise, sowie hohe Belastbarkeit und Durchsetzungsvermögen Darauf können Sie sich freuen Arbeiten inmitten schöner Natur- und Erholungsgebiete Spannende Aufgaben im internationalen Umfeld mit kurzen Entscheidungswegen Viel Eigenverantwortung und eine attraktive Führungsposition Marktgerechte Entlöhnung, fortschrittliche Sozialleistungen und eigene Pensionskasse mit guten Leistungen Personalrestaurant, Gratisparkplätze Über uns EMS hat 25 Produktionsstandorte in 16 Ländern, beschäftigt weltweit rund 3'000 Mitarbeiter und ist mit rund 140 Lernenden der grösste Berufsbildner im Kanton und Träger des Nationalen Bildungspreises. EMS-SERVICES ist für den Betrieb des Werkplatzes mit weiteren angesiedelten Unternehmen verantwortlich und stellt seine Dienstleistungen in den Bereichen Engineering, Energiebereitstellung, Unterhalt, Logistik, Immobilien, Informations-Technologie, Personalmanagement, Rechnungswesen und Controlling sowie Umweltschutz und Sicherheit zur Verfügung. Ihre Ansprechpersonen Weitere Auskünfte erteilt Ihnen gerne Roman Hepberger unter der Telefonnummer +41 (0) 81 632 76 37 EMS-CHEMIE AG Via Innovativa 1 7013 Domat/Ems",On-site,2026-04-10T08:26:43+02:00,https://www.jobs.ch/en/vacancies/detail/c10b07c7-1283-4bcb-828d-0d7c96c64df0/,c10b07c7-1283-4bcb-828d-0d7c96c64df0
Consulting/Company Development,124,Studiengangsleiter:in für BSc/MSc in Business Administration 80-100 %,Kalaidos Fachhochschule AG,Zürich,CHF 90634 - 130634 (jobs.ch estimate),"Die Kalaidos Fachhochschule ist eine eidgenössisch anerkannte und akkreditierte Fachhochschule und bietet flexible, berufs- und familienbegleitende Aus- und Weiterbildungen in den Bereichen Wirtschaft, Recht, Musik, Angewandte Psychologie und Gesundheit an. Gegründet im Jahr 1997, ist die Kalaidos Fachhochschule heute mit über 12'000 Ehemaligen und rund 4’000 Studierenden die grösste private Fachhochschule der Schweiz und bietet das breiteste Angebot an berufsbegleitenden Studiengängen. Für unser Prorektorat Lehre suchen wir per sofort oder nach Vereinbarung eine:n Als Studiengangsleiter:in Business Administration stellen Sie sicher, dass unsere berufsbegleitenden Studiengänge inhaltlich stimmig, fachlich aktuell und praxisrelevant bleiben. Sie begleiten die Studierenden durch ihr Studium, achten auf die Qualität und Weiterentwicklung der Module und behalten dabei sowohl die Bedürfnisse des Marktes als auch die wirtschaftliche Tragfähigkeit im Blick, während Sie im Hintergrund dafür sorgen, dass Planung, Abläufe und Administration reibungslos funktionieren. Die Funktion eignet sich besonders für erfahrene Praktiker:innen aus der Privatwirtschaft mit universitärem Hintergrund, die ihr Fachwissen an der Schnittstelle von Theorie und Praxis in einem bildungsnahen Umfeld einsetzen möchten. Das sind Ihre Hauptaufgaben: Verantwortung für den operativen Betrieb und die inhaltliche Ausgestaltung der Studiengänge im Bereich Business Administration sowie Banking & Finance im Rahmen der hochschulweiten Vorgaben Mitverantwortung für die wirtschaftliche Weiterentwicklung der Studiengänge sowie deren marktgerechte Positionierung, inkl. Konzeption und Weiterentwicklung von Modulen/Curricula und aktiver Mitwirkung bei der Vermarktung des Bildungsangebots (z.B. Informationsveranstaltungen) Qualitätssicherung der Studiengänge und Module sowie Gewährleistung der Einhaltung von Prozessen und Reglementen Individuelle Beratung und Begleitung der Studierenden über alle Studienphasen hinweg Auswahl, Führung und Begleitung von Dozierenden Vertretung der Studiengänge nach innen und aussen sowie Pflege und Ausbau der Beziehungen zu Studierenden, Branchenvertretungen und weiteren relevanten Stakeholdern Mitwirkung in Gremien und Projekten der Fachhochschule Das bringen Sie mit: Hochschulabschluss (MA/MSc oder Lic zwingend) in einer betriebswirtschaftlichen Studienrichtung Mehrjährige Berufserfahrung in betriebswirtschaftlichen, praxisnahen und marktorientierten Funktionen Erfahrung im Projektmanagement von Vorteil Selbstständige, strukturierte und verantwortungsvolle Arbeitsweise sowie ausgeprägte Umsetzungstärke und Belastbarkeit. Sicheres, adressatengerechtes Auftreten mit hoher Service- und Kundenorientierung im Umgang mit Studierenden, Dozierenden und weiteren Stakeholdern Sehr gute Deutschkenntnisse; Englisch und/oder Französisch von Vorteil Sicherer Umgang mit MS Office sowie Affinität zu digitalen Lehr- und Lernformaten (z.B. LMS-Plattformen) Das bieten wir Ihnen: Eine vielfältige Aufgabe mit grosser Selbständigkeit und Eigenverantwortung Ein engagiertes Team und unterstützende Arbeitskollegen in einem professionellen Arbeitsumfeld Zeitgemässe Anstellungsbedingungen (40 h/Woche, mind. 25 Tage Ferien, Übernahme der KTG- und UVG-Beiträge, UVG-Zusatzversicherung, eigene Personalvorsorgestiftung, usw.) Interne Aus- und Weiterbildungsmöglichkeiten sowie attraktive Mitarbeiterrabatte Flexible Arbeitszeiten, Möglichkeit für Homeoffice, sowie ein zentral gelegener Arbeitsplatz in Zürich Oerlikon (ca. 5 Gehminuten vom Bahnhof Zürich Oerlikon) Spricht Sie diese Aufgabe an? Dann freuen wir uns auf Ihre Bewerbung über diesen Bewerbungslink . Bewerbungen per E-Mail oder per Post können wir leider nicht berücksichtigen. Für weitere Auskünfte steht Ihnen Herr Dr. Alexander Strunck, gerne unter Tel: +41 44 307 38 98 zur Verfügung. Weitere Informationen zur Kalaidos Fachhochschule AG finden Sie unter: www.kalaidos-fh.ch Kalaidos Fachhochschule AG Herr Dr. Alexander Strunck Studiendirektor +41 44 307 38 98 E-Mail schreiben",Hybrid,2026-04-10T08:33:27+02:00,https://www.jobs.ch/en/vacancies/detail/cf7de083-fcff-4178-bdc2-d70a6d6b9beb/,cf7de083-fcff-4178-bdc2-d70a6d6b9beb
Consulting/Company Development,124,Leiter:in Flexibilität und Produkte Energie,enalpin AG,Visp,CHF 75000 - 115000 (jobs.ch estimate),"Energie ist unsere Stärke Die enalpin AG mit Sitz in Visp hat Tradition – und immer noch jede Menge Energie: Seit über 100 Jahren produzieren wir Ökostrom aus 100 % Walliser Wasser- und Sonnenkraft. Auch in den Bereichen Photovoltaik, Wärmelösungen und Mobilität entwickeln wir uns stetig weiter und realisieren nachhaltige Projekte zusammen mit Gemeinden, Gewerbe und Privatpersonen. Wir verfolgen das Ziel der Klimaneutralität und tragen dazu bei, den CO 2 -Ausstoss kontinuierlich zu reduzieren. Zur Verstärkung unseres Teams suchen wir per sofort oder nach Vereinbarung eine/n Leiter:in Flexibilität und Produkte Energie (100%) Arbeitsort: Visp Hier kommt deine Energie zum Einsatz: Du verantwortest den Aufbau, die fachliche Führung und die Weiterentwicklung des Fachbereiches «Flexibilität & Produkte»: Du entwickelst neue energiewirtschaftliche Produkte und Geschäftsmodelle (z. B. Batterien, Flexibilitätsvermarktung, virtuelle Kraftwerke, Pooling-Modelle und Multi-Use-Strategien); Du analysierst deren Einsatzmöglichkeiten und Erlöspotenziale in allen relevanten Märkten (Spot, Intraday, Systemdienstleistungen, Ausgleichsenergie etc.); Du übernimmst die Gesamtverantwortung für die Einführung sowie die operative und strategische Nutzung dieser Produkte, gestützt auf soliden Wirtschaftlichkeits? und Business?Case?Analysen; Du beobachtest regulatorische Entwicklungen und passt die Produkte- und den Geschäftsmodell-Mix entlang von Markt- und Regulierungsänderungen an. Du arbeitest dabei eng mit den Bereichen Handel, Portfolio-Management und Betrieb zusammen; Du sprichst relevante Partner aktiv an (EVU, Gross?Asset?Besitzer, Flexibilitätsanbieter), betreust und entwickelst diese weiter. Das bringst du mit: Du verfügst über einen Hochschulabschluss (ETH/Uni/FH) und/oder über einen praxisorientierten Bildungsweg mit langjähriger relevanter Erfahrung in der Energiewirtschaft; Du bringst fundierte Erfahrung in der Energiewirtschaft mit und verfügst über sehr gute Kenntnisse der Strommärkte, Flexibilitätsmechanismen sowie der relevanten regulatorischen Rahmenbedingungen; Du hast Erfahrung im Aufbau und in der Weiterentwicklung neuer Geschäftsfelder oder energiewirtschaftlicher Produkte; Du verfügst über ein ausgeprägtes Leadership-Verständnis und hast Erfahrung in der Führung und Motivation kleiner Teams; Du denkst unternehmerisch, handelst umsetzungsstark und arbeitest mit hoher Hands-on-Mentalität. Wir bieten dir: eine Schlüsselrolle im strategischen Ausbau der Energiewirtschaft bei der enalpin. Du erhältst grossen Gestaltungsspielraum und hast die Möglichkeit, Themen aktiv voranzubringen – mit direkter Wirkung auf die Unternehmensentwicklung und messbaren Ergebnisbeiträgen. Zudem bieten wir dir einen interessanten und modernen Arbeitsplatz direkt am Bahnhof von Visp. Du arbeitest mit einem motivierten Team und profitierst von überzeugenden Anstellungs- und Arbeitsbedingungen, überdurchschnittlichen Sozialleistungen und sechs Wochen Ferien. Wenn dich diese Herausforderung anspricht, freuen wir uns auf deine Bewerbungsunterlagen. Diese sendest du bitte bis zum 4. Mai 2026, vorzugsweise per Mail, an E-Mail schreiben . enalpin AG Herr Martin Wasmer Leiter Personal 027 945 75 72 E-Mail schreiben",On-site,2026-04-10T08:33:55+02:00,https://www.jobs.ch/en/vacancies/detail/ec3d0e24-009a-4e98-80ec-4638b2cc7861/,ec3d0e24-009a-4e98-80ec-4638b2cc7861
Consulting/Company Development,124,Junior Betriebswirtschafter*in,Marti Dienstleistungen AG,Moosseedorf,CHF 74500 - 114500 (jobs.ch estimate),"1922 als kleines Familienunternehmen gestartet, ist die Marti-Gruppe über die Jahrzehnte gewachsen. Heute gehören über 80 Konzerngesellschaften aus allen Bereichen der Baubranche zu uns. Eine davon sind wir, die Marti Dienstleistungen AG. Wir sind die zentrale Dienstleisterin der Marti Gruppe und übernehmen übergeordnete Interessen wahr. Wir beraten und unterstützen mit unseren Fachleuten in den Bereichen Finanzen, Personal, Versicherung, Informatik, Marketing & Kommunikation, Einkauf, Recht und Engineering. Junior Betriebswirtschafter*in HIER KANNST DU MITWIRKEN Du unterstützt und entlastest die Konzernleitung in administrativen und organisatorischen Belangen Du erstellst Präsentationen und Konzepte Du unterstützt diverse Projekte Du analysierst und optimierst Prozesse Du erstellst aufschlussreiche Unternehmensanalysen und leitest daraus entsprechende Handlungsmassnahmen ab Du betreust eine*n KV-Lernenden als Praxisbildner*in DEIN FUNDAMENT Du verfügst über ein abgeschlossenes Bachelorstudium im Bereich Betriebswirtschaft oder eine kaufmännische Grundausbildung mit Weiterbildung in Betriebswirtschaft (Stufe HF/FH) Du bist eine engagierte und kommunikative Persönlichkeit, die gekonnt als Dienstleister*in agiert Du überzeugst mit deinem unternehmerischen Denken und deiner Teamfähigkeit Du verfügst über ein hohes Mass an Selbständigkeit und Flexibilität Du hast eine hohe Affinität für IT-Systeme und hast die Passion, Dinge anzupacken und zu Ende zu führen Du bist offen für die Besonderheiten einer föderalen Firmenstruktur Du bringt sehr gute Deutsch- und Französischkenntnisse mit DAS ERWARTET DICH Ein spannendes und abwechslungsreiches Arbeitsumfeld mit breitem Einsatzgebiet und Tätigkeitsfeld Mitgestaltung in einer Branche im digitalen Wandel Interessante Projekte in der ganzen Schweiz Moderne Arbeitsmittel und Arbeitsplätze gehören bei uns zum Standard Eine spannende und abwechslungsreiche Herausforderung in einem familiengeführten Konzern, wo traditionelle und moderne Werte zusammengehören Ein Parkplatz direkt vor der Tür oder ein Shuttlebus zum Bahnhof Zollikofen (Hin- und Rückfahrt) INTERESSIERT? Dann freuen wir uns über deine Bewerbung! Für weitere Auskünfte zur Stelle steht dir Nada Dujak, Leiterin Personal, Tel. Nr. +41 31 388 74 72, gerne zur Verfügung. Marti Dienstleistungen AG Seedorffeldstrasse 21 | 3302 Moosseedorf",On-site,2026-04-10T10:03:10+02:00,https://www.jobs.ch/en/vacancies/detail/dfcba00c-d69c-4b5d-9055-62120baa0014/,dfcba00c-d69c-4b5d-9055-62120baa0014
Consulting/Company Development,124,"Business Development Manager (100%, f/m)",Keller Swiss Group AG,Versoix,CHF 88000 - 128000 (jobs.ch estimate),"Lorsque des personnes s’installent dans de nouveaux lieux, nous intervenons. Nous accompagnons notre clientèle dans tous les aspects d'une relocation internationale. Cela inclut la recherche de logement, l’obtention des visas, la coordination du transport des biens ménagers, et bien plus encore. La Keller Swiss Group est reconnu pour son professionnalisme et sa haute qualité, ce qui lui confère une excellente réputation dans tout le secteur. Vous souhaitez, vous aussi, contribuer à faire rayonner nos valeurs auprès de nos clients en rejoignant notre équipe ? Pour notre site de Genève, nous recherchons, pour une entrée en fonction immédiate ou à convenir, une personne engagée, dynamique et motivée pour le poste de Business Development Manager (100%, f/m) Votre domaine d'activité passionnant: Acquisition de nouveaux clients (business-to-business) en Suisse romande Création de présentations et traitement des appels d'offres Suivi des clients réguliers acquis Observation du marché et analyse des besoins des clients Représentation lors d'événements de réseautage / organisations Gestion de la base de données interne Reporting et contrôle de gestion vis-à-vis des clients, des fournisseurs, des collaborateurs et de la direction Votre profil: Formation commerciale de base achevée, formation complémentaire dans le domaine de la vente souhaitable Expérience dans la vente dans le domaine des services, des ressources humaines/mobilité internationale ou des visas et de l'immigration serait un plus Maîtrise du français et de l'anglais (à l'oral et à l'écrit) Aptitude à la négociation et capacité à mener à bien les entretiens de vente Résistance au stress et capacité à garder une vue d'ensemble et à fixer des priorités, même dans des situations mouvementées Personnalité orientée vers le client et le service, avec de bonnes manières et une présentation soignée et assurée Permis de conduire et disposition à voyager (en Suisse) sont requis Ce que nous vous offrons: Un défi varié, diversifié et passionnant dans un environnement international Formation complète Conditions d'emploi supérieures à la moyenne Entreprise stable, leader sur le marché et réputée pour sa qualité Possibilités d'évolution de carrière et de formation continue Pour toute question concernant ce poste, veuillez contacter Mme Elisabetta Vogel par téléphone au 058 317 10 00. Nous attendons avec impatience votre candidature complète par voie électronique, accompagnée d'une photo et de vos prétentions salariales.",On-site,2026-04-11T21:08:05+02:00,https://www.jobs.ch/en/vacancies/detail/687db588-9018-47a2-a69f-29c3b9bc266c/,687db588-9018-47a2-a69f-29c3b9bc266c
Engineering/Watches,108,Horloger (H/F),Accès Personnel SA,1227 Les Acacias,,"Pour le compte de l’un de nos clients, nous recherchons un/une : Horloger (H/F) Vos missions : Assemblage et emboîtage de mouvements mécaniques et/ou quartz Réglage et mise en marche des montres Contrôle esthétique et fonctionnel Diagnostic, entretien et réparations Respect des procédures qualité et des standards horlogers Travail en environnement propre et exigeant Votre profil : Formation en horlogerie (CFC ou équivalent) Expérience confirmée ou première expérience réussie en atelier Très bonne dextérité manuelle et sens du détail Rigueur, minutie et autonomie Esprit d’équipe et sens des responsabilités Sensibilité à la qualité et à la précision 15 Rue Eugène Marziano 1227 Acacias",On-site,2026-04-18T02:00:04+02:00,https://www.jobs.ch/en/vacancies/detail/4a667ebd-d914-4fd8-ab51-9aeacd57453f/,4a667ebd-d914-4fd8-ab51-9aeacd57453f
Engineering/Watches,108,"Electromécanicien, monteur H/F à 100%",OK JOB SA,Genève,,"Pour le compte de notre client, nous recherchons un(e) Electromécanicien, monteur H/F à 100% CFC Automaticien/Electromécanicien ou équivalent, ou 3 ans d'expérience similaire en environnement industriel Débrouille et polyvalent(e), capacité à effectuer des tâches répétitives Excellente dextérité Esprit d'équipe et flexibilité Disponible de suite Assembler des sous-ensembles et/ou appareils électroniques avec la documentation à disposition (suivi des OF, procédure, plan, dessin...) Assurer la qualité du travail et le respect des directives qualité des produits fabriqués (serrage au couple, technique de collage...) Vérifier l'outillage des lignes de production selon les procédures, assurer l'entretien de ces lignes Remonter les problèmes rencontrés en production en utilisant le suivi des pièces Rue Michel-Roset 2 1201 Genève",On-site,2026-04-18T02:00:04+02:00,https://www.jobs.ch/en/vacancies/detail/98b378aa-4a8d-4d75-9d41-fe6ba8885677/,98b378aa-4a8d-4d75-9d41-fe6ba8885677
Engineering/Watches,108,Contrôleur composants Mouvements H/F à 100%,OK JOB SA,NYON,,"Pour le compte de notre client, nous recherchons un Contrôleur qualité sur composants mouvements H/F, qui sera en charge Contrôleur composants Mouvements H/F à 100% 3 ans d'expérience en contrôle qualité sur composants mouvements IMPERATIF Bonne maitrise des outils de mesure horlogers type Optimes J1, comparateur horizontal, jauges à tampon lisse, Marcel Aubert... Excellente organisation et méthodologie A l'aise avec l'outil IT (Pro concept, Quick Control) Excellente dextérité et acuité visuelle Esprit qualité et autonomie Capacité à assurer la cohérence entre le processus de production (gammes opératoires) et les exigences du contrôle qualité (gammes de contrôle) DISPONIBLE DE SUITE Contrôle esthétique et dimensionnel des composants mouvements (platines, ponts, axes, canons...) Contrôler les battements Vérifier l'état des axes et des pivots Identifier les défauts techniques et non-conformités Respecter les procédures qualité Rue Michel-Roset 2 1201 Genève",On-site,2026-04-18T02:00:04+02:00,https://www.jobs.ch/en/vacancies/detail/82b1565f-32bb-4a52-9182-af53f9d7a7db/,82b1565f-32bb-4a52-9182-af53f9d7a7db
Engineering/Watches,108,Horloger Restaurateur & Grandes Complications H/F,Breguet (Montres) SA,Orient,CHF 45179 - 85179 (jobs.ch estimate),"Introduction de la société Symbole de patrimoine historique et culturel ainsi que d'avant-garde technologique, Breguet s'inscrit en tant que référence absolue en matière de haute horlogerie. Nous n'avons de cesse de proposer des garde-temps toujours plus fascinants, alliant complications techniques et esthétique épurée. Description du poste Vos responsabilités : Analyser les pièces anciennes afin de définir précisément les interventions nécessaires à leur restauration. Établir des devis complets en tenant compte de l'ensemble des travaux à réaliser. Restaurer les mouvements et fabriquer les composants requis dans le respect des techniques horlogères traditionnelles. Constituer et maintenir des dossiers de restauration complets, incluant : l'historique de la montre et de ses détenteurs, la description détaillée du mécanisme et des complications, les interventions effectuées et les composants remplacés ou fabriqués. Rechercher et collaborer avec des artisans spécialisés pour la restauration des éléments non horlogers. Assembler des montres Grandes Complications, telles que : montres de poche grande sonnerie, tourbillons, pendules sympathiques, pièces uniques à haute valeur patrimoniale. Profil Compétences requises Vos compétences : D iplôme de Technicien ES en restauration horlogère. Expérience significative (7 ans) dans la restauration de pièces anciennes et dans l'assemblage de grandes grandes complications. Capacité avérée à fabriquer, restaurer et ajuster des composants horlogers. Maîtrise des techniques suivantes : pivotage, limage, polissage, réglage, tournage, fraisage, décoration horlogère. Aisance dans la lecture et l'interprétation de documents techniques CAO (Catia, 3D Via Composer, etc.). Autonomie, rigueur, minutie et sens de l'organisation irréprochables. Esprit ouvert, attitude positive, communication assertive et approche proactive dans les projets et les collaborations pluridisciplinaire. Langues Maîtrise parfaite de la langue française à l'écrit comme à l'oral La maîtrise de l'anglais est un atout Lieu de travail 1341 L'Orient Personne de contact Laëtitia Perrin 23 Place de la Tour 1344 L´Abbaye",On-site,2026-04-18T02:00:04+02:00,https://www.jobs.ch/en/vacancies/detail/ec5fbd68-b30c-4eb1-910b-b03d5126565f/,ec5fbd68-b30c-4eb1-910b-b03d5126565f
