category,category_id,job_title,company,location,salary_range,skills_text,contract_type,date_posted,job_url,job_id
Banking/Insurance,102,Senior Strategic Controller (all genders),AXA,Winterthur / Smart Working,,"Jede Erfolgsgeschichte beginnt mit dem Glauben an sich selbst. Als AXA sehen wir uns als Partnerin, die an deiner Seite steht und an dich glaubt. Deshalb fordern und fördern wir dich und zeigen dir proaktiv Möglichkeiten für deine Zukunft auf. Wir ermutigen dich und bieten dir Freiräume, damit du die Dinge, die dir wichtig sind, miteinander verbinden kannst. Gemeinsam mit deinem Engagement und deinem individuellen Beitrag wird daraus eine zukunftsweisende Partnerschaft. Für dich, für uns und für unsere Kundinnen und Kunden. Und das nicht nur für den Moment. Sondern auf lange Sicht. Schreibe jetzt mit uns deine eigene Erfolgsgeschichte. Know You Can. Senior Strategic Controller (all genders) Für unser im Bereich Finance angesiedeltes Cost Management Team suchen wir Verstärkung. Werde Teil unseres dynamischen Teams und bringe deine Expertise ein, um strategische Weichen für die Zukunft der AXA Schweiz zu stellen! Gemeinsam im Team verantwortest du die strategische Kostensteuerung der AXA Schweiz und positionierst Cost Management als zentralen Werttreiber der Unternehmensstrategie – in enger Zusammenarbeit mit Stakeholdern auf allen Ebenen. Bist du eine motivierte Persönlichkeit, die ein wertschätzendes Teamklima schätzt und mit Leidenschaft Verantwortung übernimmt?Ein Kommunikationstalent, das komplexe Zusammenhänge verständlich macht und proaktiv Themen vorantreibt? Dann bist du bei uns genau richtig! Dein Beitrag Du gestaltest die strategische Kostensteuerung der AXA Schweiz aktiv mit und positionierst unser Cost Management als zentralen Hebel zur Wertsteigerung und zur Umsetzung der Unternehmensstrategie. Du entwickelst und optimierst strategische Budget- und Prognoseprozesse und verankerst dabei eine vorausschauende Steuerungslogik in enger Zusammenarbeit mit verschiedenen Stakeholdern. Du behältst die Kostenentwicklung stets im Blick, analysierst Abweichungen und leitest klare, umsetzungsorientierte Handlungsempfehlungen für das Management zur Unterstützung des strategischen Finanzplans ab. Zudem agierst du als Sparringspartner:in auf Augenhöhe und berätst die dezentralen Ressort-Controller:innen sowie Business Stakeholder sowohl im operativen Tagesgeschäft als auch bei der Identifikation und Realisierung strategisch relevanter Einsparpotenziale. Du stellst ein transparentes und adressatengerechtes Kostenreportings auf Konzernleitungsebene sicher und präsentierst Management-Insights überzeugend in Quartalsabschlüssen, Forecasts und Planungszyklen. Du agierst als Finance Business Partner für strategische Investments, bewertest Business Cases und stellst die finanzielle Tragfähigkeit von Initiativen sicher. Du treibst die Weiterentwicklung und Automatisierung unserer Kostenprozesse voran, indem du Impulse für Effizienz und Innovation setzt und entsprechende Projekte verantwortest. Deine Fähigkeiten und Talente Abgeschlossenes Studium in Betriebswirtschaft, Finanzen, Volkswirtschaft oder eine vergleichbare Qualifikation; ein weiterführender Abschluss (z. B. Master, MBA, CFA) ist von Vorteil. Mehrjährige Erfahrung in einer Senior Rolle im Financial Steering und/oder in einem analytisch und strategisch geprägtem Umfeld (z.B. Strategieberatung). Ausgeprägte analytisch-konzeptionelle Stärke sowie die Fähigkeit, komplexe Sachverhalte schnell zu durchdringen und in klare, entscheidungsrelevante Empfehlungen für das Management zu übersetzen Proaktive und lösungsorientierte Persönlichkeit mit starkem Teamgeist und hoher Eigeninitiative, die bereit ist, Verantwortung für Arbeitspakete zu übernehmen – von der Hypothesenbildung über die Analyse bis zur Umsetzung. Strukturierte und pragmatische Arbeitsweise mit der Fähigkeit, auch in ambigen und komplexen Situationen Orientierung zu geben und Entscheidungen herbeizuführen. Sehr gute Kommunikationsfähigkeiten und souveränes Auftreten gegenüber unterschiedlichen Stakeholdern – von operativen Teams bis zum Top Management. Du lebst die Werte der AXA – modern, menschlich und einfach – und überzeugst mit einem modernen Umgang mit Tools, Empathie im Kontakt und klarer Kommunikation. Über AXA Bei uns gestaltest du nicht nur die Finanzstrategie, sondern bist aktiv daran beteiligt, die Zukunft der AXA Schweiz mitzugestalten. Wir bieten dir einen verantwortungsvollen, abwechslungsreichen Arbeitsplatz, flexible Arbeitsmodelle und ein Umfeld, das Innovation und Zusammenarbeit fördert. Erfahre mehr über die AXA Bewirb dich jetzt! Bei Fragen rund um diese Stelle ist Sandra Volken, Recruiting Partner, gerne für dich da, per E-Mail schreiben Motivationsschreiben? Darauf verzichten wir. Wir freuen uns stattdessen über deine Antworten auf unsere kurzen Fragen zur Stelle im Online-Bewerbungs-Tool. Aus Datenschutzgründen werden nur Bewerbungen berücksichtigt, welche über den Online-Bewerbungslink eingereicht werden.",On-site,2026-04-18T05:02:53+02:00,https://www.jobs.ch/en/vacancies/detail/ca8d5bf1-0659-4546-8b47-fad533d9fe51/,ca8d5bf1-0659-4546-8b47-fad533d9fe51
Banking/Insurance,102,Teamlead Underwriting Haftpflicht – Unternehmenskunden (all genders),AXA,Winterthur,,"Jede Erfolgsgeschichte beginnt mit dem Glauben an sich selbst. Als AXA sehen wir uns als Partnerin, die an deiner Seite steht und an dich glaubt. Deshalb fordern und fördern wir dich und zeigen dir proaktiv Möglichkeiten für deine Zukunft auf. Wir ermutigen dich und bieten dir Freiräume, damit du die Dinge, die dir wichtig sind, miteinander verbinden kannst. Gemeinsam mit deinem Engagement und deinem individuellen Beitrag wird daraus eine zukunftsweisende Partnerschaft. Für dich, für uns und für unsere Kundinnen und Kunden. Und das nicht nur für den Moment. Sondern auf lange Sicht. Schreibe jetzt mit uns deine eigene Erfolgsgeschichte. Know You Can. Teamlead Underwriting Haftpflicht – Unternehmenskunden (all genders) Gestalte die Zukunft des Haftpflicht-Underwritings – mit deiner Expertise und deiner Lust auf Leadership. Du bist fachlich stark, hast dir über die Jahre ein tiefes Verständnis für Haftpflicht- und Vermögensschadenrisiken aufgebaut – ob über ein Studium oder durch langjährige Branchenerfahrung! Und suchst nun eine Rolle, in der du mehr bewegen kannst? Dann wird diese Aufgabe bei AXA genau das Richtige für dich. Wir suchen keine perfekte Führungskraft. Wir suchen jemanden, der Menschen entwickeln möchte, Freude daran hat, gemeinsam Lösungen voranzubringen und die nächste Evolutionsstufe unseres Haftpflicht-Underwritings mitgestaltet. Dein Beitrag Führen & Fördern Du übernimmst die fachliche und menschliche Führung von acht erfahrenen Underwriter*innen in Winterthur. Du schaffst ein Umfeld, in dem Zusammenarbeit, Mut und Weiterentwicklung selbstverständlich sind. Hochfachliches Arbeiten auf Top-Niveau Du bist Sparringpartner*in für komplexe Fachfragen rund um Allgemeine und Vermögensschadenhaftpflicht. Für unsere Kundinnen und Kunden stellst du einen effizienten, präzisen und professionellen Underwriting-Service sicher. Gestalten statt nur verwalten Du wirst Teil des Führungsteams und treibst die Weiterentwicklung unseres Haftpflichtgeschäfts in der Deutschschweiz aktiv voran. Ob Transformation, Effizienzsteigerung oder neue KI-Use-Cases: Du bringst dich ein – mit Erfahrung, Neugier und Gestaltungswillen. People Development als Herzensanliegen * Du hilfst deinem Team, Stärken zu erkennen und Potenziale freizusetzen – fachlich und persönlich. Deine Fähigkeiten und Talente Fachliche Reife: du kennst das Haftpflichtgeschäft – idealerweise Unternehmenskunden – und weisst, was anspruchsvolle Risiken bedeuten. Analytisches Denken: Zahlen schrecken dich nicht ab, sie inspirieren dich zu klaren, tragfähigen Entscheidungen. Interesse an Leadership: Du musst keine erfahrener Manager*in sein – wichtiger ist uns deine Leidenschaft, Menschen zu begleiten und Verantwortung zu übernehmen. Klarheit & Empathie: Du kommunizierst wertschätzend, transparent und kannst auch in kniffligen Situationen Orientierung geben. Offenheit für Wandel: Transformation verstehst du als Chance – sowohl für dich selbst als auch für dein Team. Warum AXA? Weil du hier echte Wirkung entfalten kannst. Im Bereich Property & Casualty gehören innovative Produkte, digitale Prozesse und ein klarer Fokus auf Kundenorientierung zu unserem Alltag. Und genau dort brauchen wir Menschen wie dich – die fachlich stark sind, einen Blick fürs Ganze haben und Lust darauf, die Zukunft des Underwritings aktiv mitzugestalten. Über AXA Im Bereich Property & Casualty schaffen wir mit innovativen Produkten, überzeugenden Dienstleistungen und einfachen digitalen Prozessen Freiräume für unsere Privat- und Unternehmenskunden. Dabei bieten wir eine breite Palette an standardisierten und individuellen Versicherungen, Rechtsschutz sowie finanzielle Sicherheit im Bereich Kredit & Kaution an. Erfahre mehr über die AXA Bewirb dich jetzt! Bei Fragen rund um diese Stelle ist Sandra Volken, Recruiting Partner, gerne für dich da, per E-Mail schreiben Motivationsschreiben? Darauf verzichten wir. Wir freuen uns stattdessen über deine Antworten auf unsere kurzen Fragen zur Stelle im Online-Bewerbungs-Tool. Aus Datenschutzgründen werden nur Bewerbungen berücksichtigt, welche über den Online-Bewerbungslink eingereicht werden.",On-site,2026-04-18T05:02:53+02:00,https://www.jobs.ch/en/vacancies/detail/4ae59b62-ba79-41b6-908b-23a4c4da625b/,4ae59b62-ba79-41b6-908b-23a4c4da625b
Banking/Insurance,102,Credit Officer (w/m/d),Raiffeisen Gruppe,Bülach,,"Oisi Bank. Oisi Lideschaft. Die Raiffeisenbank Züri-Unterland mit den Standorten in Bülach, Neerach und Regensdorf ist eine erfolgreiche Bank mit einem hohen Kundenvertrauen und einer starken Verankerung in der Bevölkerung. Für unseren Hauptsitz in Bülach, mit modernsten Arbeitsplätzen, suchen wir eine unternehmerisch denkende, risikobewusste und fachlich qualifizierte Persönlichkeit als Credit Officer (w/m/d). Credit Officer (w/m/d) Was erwartet dich? Beurteilung, Prüfung und Bewilligung von Kreditanträgen von Privat- und Firmenkunden sowie periodischen Neubewilligungen im Rahmen deiner Kompetenzen. Erstellung von Immobilienbewertungen mittels bankeigenen Bewertungs-Tools Fachliche Unterstützung und Beratung der Kundenberater:innen bei Kreditfragen, Spezialfällen und Ausnahmebewilligungen. Erkennen, Einordnen und Adressieren von Kreditrisiken – inklusive Aufzeigen von tragfähigen Alternativlösungen. Mitarbeit bei der Überwachung bestehender Kreditpositionen (z.B. Baukreditkontrollen) Sicherstellen der Einhaltung regulatorischer, rechtlicher und interner Vorgaben. Zusätzlich übernimmst du Aufgaben in der Kreditverarbeitung Verarbeitung und Bewirtschaftung von neuen und bestehenden Kreditpositionen. Prüfung der Vollständigkeit von Kreditunterlagen sowie Erstellung und Abwicklung von Kreditverträgen. Unterstützung der Kreditberatung bei der Aufbereitung von Kreditgesuchen und Datenerfassungen. Koordination mit internen Stellen sowie externen Partnern (z. B. Ämter, Versicherungen, Pensionskassen). Was bringst du mit? Bankfachliche Ausbildung sowie mehrjährige Erfahrung im Kreditgeschäft. Weiterbildungen im Kredit- oder Immobilienbereich sind willkommen Freude an analytischem Arbeiten und ein ausgeprägtes Risikobewusstsein. Sehr gute Kenntnisse im Bereich Finanzierungen, idealerweise auch im Firmenkundengeschäft. Selbstständige, strukturierte und zuverlässige Arbeitsweise. Kommunikationsstärke im Austausch mit Kundenberater:innen – sachlich, lösungsorientiert, klar. Interesse, dein Fachwissen laufend weiterzuentwickeln. Was bieten wir? Eine fachlich anspruchsvolle Rolle mit hoher Verantwortung, aber ohne Verkaufsdruck. Enge Zusammenarbeit mit erfahrenen Kundenberater:innen und Führungspersonen. Ein professionelles, kollegiales Umfeld mit kurzen Entscheidungswegen. Moderne Arbeitsbedingungen und eine Arbeitgeberin, die Stabilität mit Entwicklung verbindet. Arbeiten für eine Bank, die regional verankert ist – und genau deshalb nachhaltig denkt. Wir pflegen ein familiäres Umfeld Die genossenschaftlichen Werte sind unsere Grundpfeiler: Miteinander. Füreinander. Sie prägen unsere Zusammenarbeit und unseren Umgang miteinander. Die Du-Kultur schafft persönliche Nähe und Augenhöhe über alle Funktionsstufen hinweg. Wir leben Vielfalt und Chancengleichheit Wir fördern die unterschiedlichen Perspektiven, Erfahrungen und Kompetenzen in unseren Teams. Denn diese Vielfalt macht uns besonders und trägt entscheidend zu unserem Erfolg bei. Wir fördern persönliche und berufliche Entwicklung Lebenslanges Lernen ist Teil unserer Kultur. Wir schaffen Raum für individuelle fachliche und persönliche Entwicklung und unterstützen unsere Mitarbeitenden gezielt – mit einem vielfältigen internen Bildungsangebot sowie einer Kostenbeteiligung für externe Weiterbildungen. Wir bieten attraktive Konditionen und Sozialleistungen Unsere Mitarbeitenden profitieren von exklusiven Vorteilen bei Bankprodukten, diversen Einkaufsvergünstigungen bei Dritten sowie einer überdurchschnittlichen Altersvorsorge. Hast du Fragen? Für inhaltliche Fragen zur Stelle: Jochen Seebacher Teamleiter Credit Office +41 44 872 72 30 Für Fragen zum Bewerbungsprozess: Grazia Rubichi Mitarbeiterin Personal +41 44 872 72 07 Wir freuen uns auf deine Onlinebewerbung Über uns",On-site,2026-04-18T05:02:55+02:00,https://www.jobs.ch/en/vacancies/detail/191c60a7-7ca7-4f37-88ed-140e78c6158a/,191c60a7-7ca7-4f37-88ed-140e78c6158a
Banking/Insurance,102,Mitarbeiter/in Frontsupport,Raiffeisen Gruppe,Oberwil BL,,"Für die Raiffeisenbank Leimental, eine erfolgreiche und lokal ausgerichtete Bank im Leimental, suchen wir dich als Mitarbeiter/in Frontsupport 80 – 100%. Mitarbeiter/in Frontsupport Was erwartet dich? Das bieten wir dir Tolle Kolleginnen und Kollegen : Freue dich auf ein starkes Team, in dem Zusammenhalt, gegenseitige Unterstützung und persönliche Zusammenarbeit grossgeschrieben werden. Benefits : Wir bieten dir 5 Wochen Ferien pro Jahr und attraktive Konditionen zum Kauf von bis zu zwei Wochen zusätzlicher Ferien bei einer Wochenarbeitszeit von 40 Stunden. Du profitierst von Bankprodukt- und Einkaufsvergünstigungen, einem Halbtax-Abo, freiwilligen Familienzulagen u.v.m. Mehr Informationen zu uns und unseren Angeboten findest du auf unserer Internetseite. Perspektiven : Willst du deinen Horizont erweitern oder deine Position festigen? Wir planen mit dir gemeinsam Weiterbildungsmöglichkeiten, um dich in deiner Karriere vorwärtszubringen. Deine Mission Support: Du unterstützt unsere Kundenberatenden bei der Eröffnung von Kundenbeziehungen sowie ergänzenden Basisdienstleistungen und begleitest unsere Kundschaft bedürfnisorientiert über digitale und telefonische Kanäle. Beratung: Auch wenn administrative Supportarbeiten Hauptbestandteil deiner Arbeit sind, nimmst du in deiner Support-Funktion auch den telefonischen Kontakt wahr und unterstützt die Kundschaft oder die Kundenberatenden bei ihren Fragen oder Anliegen. Prozessmanagement: Du bringst aktiv Ideen zur Verbesserung von unseren Prozessen ein und unterstützt bei einer allfälligen Umsetzung deiner Vorschläge. Was bringst du mit? Dein Werdegang Erfahrung: Du hast bereits einige Jahre Erfahrung im Finanzdienstleistungssektor gesammelt und kennst dich mit gängigen Produkten und Regulatorien aus. Ausbildung: Du hast eine bankkaufmännische Ausbildung EFZ abgeschlossen. Allfällige Weiterbildungen oder Zertifizierungen sind Pluspunkte. Deine Arbeitsweise Teamorientiert: Du arbeitest gerne im Team und schätzt den Austausch mit Arbeitskolleginnen- und kollegen. Gemeinsam erreicht ihr hervorragende Ergebnisse und sorgt mit hoher Qualität für eine zufriedene Kundschaft. Verantwortungsbewusst: Du arbeitest selbständig und übernimmst Verantwortung. Dabei achtest du auf Genauigkeit und Sorgfalt. Engagiert: Du bringst dich aktiv ein, teilst dein Wissen und lernst gerne von anderen. Deine Motivation und dein Engagement tragen zu einem positiven Arbeitsklima bei. Wir leben Vielfalt und Chancengleichheit Wir fördern die unterschiedlichen Perspektiven, Erfahrungen und Kompetenzen in unseren Teams. Denn diese Vielfalt macht uns besonders und trägt entscheidend zu unserem Erfolg bei. Wir bieten flexible Arbeitsmodelle Die Work-Life-Balance unserer Mitarbeitenden ist uns wichtig. Deshalb schaffen wir die Voraussetzungen dafür, dass die Arbeitszeit flexibel gestaltet werden kann – mit Angeboten für mobiles Arbeiten, Homeoffice und Teilzeit-Pensen. Wir fördern persönliche und berufliche Entwicklung Lebenslanges Lernen ist Teil unserer Kultur. Wir schaffen Raum für individuelle fachliche und persönliche Entwicklung und unterstützen unsere Mitarbeitenden gezielt – mit einem vielfältigen internen Bildungsangebot sowie einer Kostenbeteiligung für externe Weiterbildungen. Wir bieten attraktive Konditionen und Sozialleistungen Unsere Mitarbeitenden profitieren von exklusiven Vorteilen bei Bankprodukten, diversen Einkaufsvergünstigungen bei Dritten sowie einer überdurchschnittlichen Altersvorsorge. Hast du Fragen? Für inhaltliche Fragen zur Stelle: Florian Furrer Leiter Frontsupport +41 (61) 4062280 Für Fragen zum Bewerbungsprozess: Simone Logo Personalverantwortliche +41 (61) 7252603 Wir freuen uns auf deine Onlinebewerbung Über uns",Hybrid,2026-04-18T05:02:55+02:00,https://www.jobs.ch/en/vacancies/detail/76448567-6c88-4069-80ad-799df35ca1ba/,76448567-6c88-4069-80ad-799df35ca1ba
Banking/Insurance,102,Gruppenleiter/in Leistungen Krankentaggeld (m/w/d) 80%-100%,VAUDOISE ASSURANCES HOLDING SA,Lausanne,CHF 62400 - 81900 (jobs.ch estimate),"Die Vaudoise ist eine der führenden Schweizer Versicherungen und eine attraktive und zukunftsorientierte Arbeitgeberin. Ganz im Sinne ihrer genossenschaftlichen Identität und ihrer Werte schafft die Vaudoise ein gesundes, inklusives und inspirierendes Arbeitsumfeld, in dem Sie sich weiterentwickeln können. Im Bereich Personenversicherungen suchen wir zur Verstärkung des Teams Krankentaggeld eine/n Gruppenleiter/in Krankentaggeld (80 bis 100%) mit Arbeitsort Wankdorf. Die Rolle umfasst einerseits die Führung eines Teams von spezialisierten Sachbearbeitern und andererseits die Bearbeitung eines kleinen Anteils an Schadendossiers. Ihre Aufgaben: Sie unterstützen und beraten Ihre Mitarbeitenden fachlich in den Dossiers Sie organisieren und koordinieren die Arbeit Ihrer Gruppe: Durchführung von Teamsitzungen, Einzelgesprächen, Planung von Vertretungen usw. Sie nehmen aktiv an den Kadersitzungen teil und arbeiten eng mit dem Dienststellenleiter sowie den anderen Gruppenleitern zusammen Sie bilden Ihre Mitarbeitenden (8-10 Personen) aus und achten auf die korrekte Anwendung der Bearbeitungsrichtlinien Sie planen, organisieren und kontrollieren die Bearbeitung der Leistungsfälle Ihres Teams und beteiligen sich aktiv an der Verbesserung und Vereinfachung der Prozesse Sie bearbeiten selbstständig und proaktiv einen Teil der Schadensfälle Ihres eigenen Kundenportfolios (ab der Eröffnung, in enger Zusammenarbeit mit den Vertrauensärzten und unseren Care Managern) Sie pflegen regelmässige Kontakte mit Partnern, Versicherten, Arbeitgebern und Leistungserbringern Ihr Profil: Fachausweis in Versicherungen oder gleichwertige Ausbildung Ausgewiesene und fundierte Erfahrung im Bereich Krankentaggeld-Leistungen Führungspersönlichkeit mit Erfahrung in der Teamleitung und Entscheidungsfreude Sehr gute Deutschkenntnisse Französischkenntnisse von Vorteil Sicherer Umgang mit den üblichen Informatiktools (MS Office) Wenn Sie zudem eine engagierte, organisierte und leistungsorientierte Führungsperson mit ausgeprägter Kundenorientierung und positiver Einstellung sind, dann sind Sie wahrscheinlich die Person, die wir suchen! Wir bieten Ihnen: Ein leistungsförderndes, modernes Arbeitsumfeld in einem genossenschaftlich geprägten Unternehmen, das mehrfach zum besten Arbeitgeber gewählt wurde Einen erfolgsfördernden, überdurchschnittlichen Arbeitsvertrag für Verkaufsprofis aus der Branche Effizientes, bestens ausgebildetes Kundensupportteam sowie Fachunterstützung im Unternehmens- und Vorsorgegeschäft Vorteilhafte Sozialleistungen, Flexibilität bei der Arbeitsorganisation und diverse Mitarbeiterrabatte Unterstützung bei der beruflichen Weiterentwicklung und Weiterbildung Wir freuen uns auf deine vollständigen Bewerbungsunterlagen auf elektronischem Weg (mit Lebenslauf, Motivationsschreiben, Kopie der Arbeitszeugnisse und Diplome).",On-site,2026-04-18T06:39:03+02:00,https://www.jobs.ch/en/vacancies/detail/5dd22974-57b4-4bd8-8245-0ea9ee55c7c6/,5dd22974-57b4-4bd8-8245-0ea9ee55c7c6
Banking/Insurance,102,"Versicherungsberater:in, 100 % in Aarau",CONCORDIA Schweizerische Kranken- und Unfallversicherung,Aarau,,"Du bist ein Verkaufstalent und gestaltest deinen Tag gerne selbst? Dann werde Teil der CONCORDIA-Familie und erobere die Verkaufsregion Aarau. Versicherungsberater:in, 100 % in Aarau Das erwartet dich Du akquirierst aktiv Neukunden und vereinbarst Termine, um bedarfsgerechte Krankenversicherungs- und Vorsorgelösungen zu verkaufen – dein Erfolg wird durch ein attraktives Provisionsmodell belohnt. Kundinnen und Kunden berätst du in der Agentur oder bei ihnen zuhause, erstellst massgeschneiderte Offerten und führst administrative Arbeiten aus. Du setzt verschiedene Verkaufsmassnahmen um, baust ein breites, persönliches Netzwerk auf und lässt dich weiterempfehlen. Deine Ideen sind gefragt: an Messe- und Standaktionen arbeitest du mit und repräsentierst die CONCORDIA vor Ort. Das bringst du mit Du hast bereits Erfahrung in einem verkaufsorientierten Umfeld gesammelt und weisst, wie man Menschen für sich gewinnt. Du hast eine abgeschlossene Berufsausbildung und bist im Besitz des Führerausweises Kat. B – so kommst du sicher ans Ziel. Du bist kontaktfreudig, kommunikativ und begeisterst mit deiner gewinnenden Art – pflegst ein starkes Netzwerk und baust dieses kontinuierlich aus. Flexibel und zielorientiert bist du bereit, gemeinsam Erfolge zu erzielen. Du bringst kaufmännische Kenntnisse mit und gehst sicher mit dem PC um – deine Deutschkenntnisse, sowohl in Wort als auch in Schrift, sind einwandfrei. Du hast die VBV-Ausbildung abgeschlossen oder bist motiviert, diese zu absolvieren – wir unterstützen dich dabei. Deine Vorteile Voller Lohn während 14 Mutterschaftswochen. Zusatzbeiträge zu Kinder- und Ausbildungszulagen. Bis zu 90 % Kostenübernahme für die Fremdbetreuung deiner Kinder. Die CONCORDIA unterstützt interne und externe Weiterbildungen. Bei deiner Karriereplanung begleiten wir dich individuell. Wir bieten dir eine äusserst attraktive, sichere Pensionskasse mit überdurchschnittlichen Arbeitgeberbeiträgen und grosszügigen Leistungen. Du und deine Familie profitieren von reduzierten Krankenversicherungsprämien. Die CONCORDIA übernimmt die Lohnabzüge für Lohnausfallversicherungen (Krankheit und Unfall) und versichert dich grosszügig. Deine Erholung ist uns wichtig: Geniesse mindestens fünf Wochen Ferien pro Jahr. Dein Arbeitsort Bahnhofstrasse 23 5001 Aarau Dein nächster Schritt Hast du weitere Fragen zu dieser Stelle? Peter Lichtsteiner, Agenturleiter Aarau, Telefon +41 62 838 20 44, hilft dir gerne weiter. Irina freut sich auf deine Bewerbung. Irina Fischer HR-Beraterin",On-site,2026-04-18T08:01:52+02:00,https://www.jobs.ch/en/vacancies/detail/3d2c6cf3-3a0f-4ee3-baec-89754c870d11/,3d2c6cf3-3a0f-4ee3-baec-89754c870d11
