category,category_id,job_title,company,location,salary_range,skills_text,contract_type,date_posted,job_url,job_id
Finance/Trusts/Real Estate,101,Treuhänder/in mit eidg. Fachausweis (80 - 100%),"K + S, Kappeler + Studerus AG",Aarau,,"Hier können Sie Ihr gesamtes Treuhand-Wissen einsetzen Unsere Auftraggeberin, die Acklin & Keusch AG (www.acklinkeusch.ch), betreut seit mehreren Jahrzehnten erfolgreich kleinere und mittelgrosse Unternehmen sowie Privatpersonen mit den Dienstleistungen Buchführung, Steuerberatung und Wirtschaftsprüfung. Im Rahmen einer Nachfolgelösung suchen wir im Auftrag der Inhaber für den Standort an verkehrsgünstiger Lage in Aarau eine/n Treuhänder/in mit eidg. Fachausweis (80 - 100%) Ihr Aufgaben- und Verantwortungsbereich Die Acklin & Keusch AG bietet Ihnen eine interessante und abwechslungsreiche Tätigkeit mit folgenden Aufgaben: Eigenständige Betreuung und Führung von Kundenbuchhaltungen – Sie sind die erste Ansprechperson für Ihre Mandate Komplette Abwicklung der Lohnbuchhaltung inklusive Quellensteuerabrechnungen, Jahreslohnmeldungen und Lohnausweisen Erstellen von Mehrwertsteuerabrechnungen für unterschiedliche Branchen und Unternehmensgrössen Vorbereiten von Steuererklärungen für natürliche und juristische Personen Durchführen von Eingeschränkten Revisionen und Prüfungen , bei denen Sie Ihr analytisches Denken einbringen Das bringen Sie mit Sie sind eine exakt, zuverlässig und selbständig arbeitende Persönlichkeit mit folgenden weiteren Eigenschaften: Abgeschlossene Ausbildung als Treuhänder/in mit eidg. Fachausweis oder eine vergleichbare Qualifikation Mehrjährige Berufserfahrung in einem Treuhandbüro Gute IT-Kenntnisse (MS Office, Dr. Tax, Proffix, ReviPS) Stilsichere Deutschkenntnisse, Englischkenntnisse von Vorteil Ihre Chance bei der Acklin & Keusch AG Werden Sie Teil eines kleinen, engagierten Teams, das Professionalität mit Menschlichkeit verbindet. Es erwartet Sie eine vielseitige Aufgabe, in der Sie Verantwortung übernehmen und Ihre Fachkompetenz täglich einbringen können. Fühlen Sie sich angesprochen? Dann freue ich mich über die Zustellung Ihrer vollständigen Bewerbungsunterlagen an Daniel Hacksteiner. Gerne erteile ich Ihnen auch telefonische Auskünfte.",On-site,2026-04-18T08:32:16+02:00,https://www.jobs.ch/en/vacancies/detail/2d6262e0-facb-4fcb-8e46-efa86643939d/,2d6262e0-facb-4fcb-8e46-efa86643939d
Finance/Trusts/Real Estate,101,Comptable Fiduciaire confirmé,Fed Group,Genève,CHF 100000 - 110000,"Fondé en 2001, le cabinet Fed Finance est spécialiste du recrutement intérimaire et permanent pour les métiers de la comptabilité et de la finance. Nos consultants sont tous des experts et parlent votre langue. Nous nous engageons à vos côtés pour vous accompagner tout au long de votre recherche d'emploi et à chaque étape de votre carrière. Présents en Suisse, France, Canada, Espagne, Belgique, Portugal et Côte d'Ivoire, nous sommes là pour vous accompagner. Comptable Fiduciaire confirmé Nous recrutons pour une fiduciaire genevoise à taille humaine, en forte croissance et orientée qualité de service. Dans un environnement professionnel moderne et structuré, vous serez l'interlocuteur principal de votre portefeuille clients et garantirez une comptabilité fiable, conforme et orientée solutions. Nous recrutons pour une fiduciaire genevoise à taille humaine, en forte croissance et orientée qualité de service. Dans un environnement professionnel moderne et structuré, vous serez l'interlocuteur principal de votre portefeuille clients et garantirez une comptabilité fiable, conforme et orientée solutions. Vos missions principales : - Assurer la gestion comptable complète d'un portefeuille clients. - Réaliser la saisie des écritures, les réconciliations bancaires et le suivi des comptes. - Produire des reportings financiers mensuels et trimestriels, ainsi que des analyses ponctuelles. - Traiter les factures fournisseurs et procéder à l'exécution des paiements. - Préparer et établir les états financiers conformément aux normes comptables applicables. - Réaliser les décomptes TVA et assurer les déclarations fiscales - Maintenir une relation client régulière et de qualité. - Participer à l'optimisation continue des processus internes et à leur digitalisation. -Brevet fédéral de spécialiste en finance et comptabilité / agent fiduciaire :fortement apprécié (obtenu ou en voie de finalisation). - 6 ans minimum d'expérience en fiduciaire en Suisse, avec maîtrise des spécificités locales (TVA, normes, fiscalité). - Fort sens du service client, capable de conseiller et d'accompagner des clients premium de manière proactive. - Excellente maîtrise du français, bon niveau d'anglais ; allemand = atout significatif. - Polyvalence, très bonne organisation, gestion des priorités, sens de la confidentialité et haut niveau d'intégrité. - Aisance avec les outils bureautiques (Excel, Word) - - Maîtrise de Winbiz, Bexio, Crésus L'annonce vous correspond ? Alors postulez et nous en discuterons ! Quai de l'Ile 13 1204 Genève",On-site,2026-04-19T02:00:10+02:00,https://www.jobs.ch/en/vacancies/detail/b7eeb533-0853-4c9c-9df8-02419f6dfa83/,b7eeb533-0853-4c9c-9df8-02419f6dfa83
Finance/Trusts/Real Estate,101,Employé administratif comptabilité FR/ANG (h/f),OK JOB SA,La Chaux-de-Fonds,,"Nous recherchons pour notre client, une entreprise innovante dans son secteur d'activité un collaborateur administratif comptabilité FR/ANG (h/f). Employé administratif comptabilité FR/ANG (h/f) Vous avez une maturité commerciale ou un titre jugé équivalent avec une expérience confirmée à ce poste de plusieurs années (idéalement en milieu horloger). Maîtrise des outils informatiques ainsi que de l'anglais avec une bonne rigueur, flexibilité et méthodologie pour évoluer en équipe afin de relever de nouveaux défis. Envie de travailler au sein d'une entreprise ambitieuse ? Rejoignez nous ! Assurer les tâches administratives, gestion et rédaction de courrier, création de rapports et saisie de données, mise à jour de dossiers, préparation d'offres, devis et suivi clients en FR/ANG. Effectuer la comptabilité, enregistrement des factures créanciers/débiteurs, gestion des comptes et bouclements, établissement des bilans, comptes de résultats, fiscalité, TVA, impôts et préparation des déclarations fiscales. Réaliser la saisie des salaires, gestion des fiches de paie, charges sociales (AVS, LPP) et déclarations auprès des assurances. av Léopold-Robert 36 2300 La Chaux-de-Fonds",On-site,2026-04-19T02:00:10+02:00,https://www.jobs.ch/en/vacancies/detail/380ad1ff-179b-4076-9661-c00622cf97f4/,380ad1ff-179b-4076-9661-c00622cf97f4
Finance/Trusts/Real Estate,101,Gérant-e immobilier,HFR Fribourg - Hôpital cantonal,Fribourg,CHF 65000 - 105000 (jobs.ch estimate),"L’hôpital fribourgeois (HFR) s’engage au quotidien pour la santé de la population. Actif sur plusieurs sites, il offre une gamme complète de soins stationnaires et ambulatoires de haute qualité, en plaçant le bien-être des patients au cœur de ses préoccupations. Respect, orientation patients, solidarité et engagement constituent les valeurs essentielles de ses 3’800 collaboratrices et collaborateurs. La Direction de la logistique recherche sa ou son futur-e Gérant-e immobilier Votre mission : Vous assurez la gestion et l’optimisation du parc immobilier des sites de l’HFR. Vous coordonnez l’attribution des locaux, les déménagements et les travaux, tout en garantissant un suivi fiable des espaces et une signalétique cohérente sur l’ensemble des sites hospitaliers. Vos principales tâches : Piloter les attributions de bureaux, de salles et de locaux Gérer les plans d’occupation Orchestrer les déménagements Mesurer et optimiser l’occupation réelle Concevoir et maintenir la signalétique HFR Gestion des contrats de location Agir comme référent-e unique pour les occupants sur toute question relative aux locaux Présenter régulièrement les recommandations stratégiques (occupation, optimisation, coûts) à la Direction Votre profil : CFC d’employé-e de commerce ; brevet fédéral de gérant-e d’immeubles ou équivalent Expérience de 3 ans minimum à un poste similaire dans une régie immobilière suisse Bonnes connaissances du droit du bail et des normes de sécurité en milieu hospitalier, un atout Très bonnes connaissances du français ou de l’allemand, tant à l’oral qu’à l’écrit, avec de bonnes connaissances de l’autre langue Esprit entrepreneurial, d’initiative et excellent sens du relationnel (entregent) Sens du service clients, de l’organisation et des priorités Entrée en fonction : de suite ou à convenir Renseignements : M. Nicolas Corpataux, responsable Sécurité et environnement HFR, tél. 41 26 306 05 55. Délai de postulation : 4 mai 2026 Postulez-ici Réf : HFR-IN-261501 Chemin des Pensionnats 2-6 1708 Fribourg",On-site,2026-04-19T02:00:10+02:00,https://www.jobs.ch/en/vacancies/detail/167d2441-00be-4f48-b674-7d201c318716/,167d2441-00be-4f48-b674-7d201c318716
Finance/Trusts/Real Estate,101,Gérant technique junior 100% (H/F),Régie Châtel SA,1618 Châtel-St-Denis,,"Active depuis plus de 47 ans dans le domaine de l’immobilier dans le sud du Canton de Fribourg et sur la Riviera Vaudoise, efficace et proche de sa clientèle, notre entreprise est à la recherche d’un-e Gérant technique junior 100% (H/F) Description non exhaustive du poste : Répondre aux appels téléphoniques Analyser la demande du locataire et identifier les actions à prendre : traitement immédiat des demandes simples, sollicitation du gérant technique pour les cas complexes Etablir des bons de travaux Etats de lieux Suivi des sinistres (cas complexes en collaboration avec le gérant technique) Saisir et mettre en page de la correspondance technique Nous offrons : Un environnement de travail agréable dans une agence immobilière familiale et de taille humaine Une activité diversifiée et autonome dans un domaine en constante évolution Très bonnes prestations sociales et salariales en rapport avec le poste Profil recherché : Titulaire d’un CFC d’employé-e de commerce/ technique ou équivalent, Expérience en immobilier, Expérience en état des lieux et un avantatge, Facilité avec les outils informatiques, Vous êtes organisé(e) et rigoureux (-se), Vous avez une bonne maîtrise du français, Vous faites preuve d’initiative, Avenue de la Gare 26 1618 Châtel-St-Denis",On-site,2026-04-19T02:00:10+02:00,https://www.jobs.ch/en/vacancies/detail/4418e670-aff2-4292-bf14-504d3a19e8d6/,4418e670-aff2-4292-bf14-504d3a19e8d6
Finance/Trusts/Real Estate,101,Membre de la direction (100%) pour son bureau de Genève,AOOS - Schweizerische Aktiengesellschaft für Aufsicht,Genf,,"AOOS est un organisme de surveillance (OS et OAR) autorisé par la FINMA. Avec des bureaux à Genève, Zurich et Lugano, il surveille les gestionnaires de fortune, trustees et autres établissements financiers qui lui sont affiliés, dans les domaines de la LSFin, LEFin et LBA. Membre de la direction (100%) pour son bureau de Genève Activités Vous dirigez les activités en Suisse romande avec trois collaborateurs et êtes responsable d'une division. Vous en déterminez les principes opérationnels en tenant compte des orientations stratégiques et des objectifs de la direction. En outre, vous assurez la surveillance concrète des établissements assujettis à AOOS. Points forts et expérience Pour cette fonction exigeante, nous faisons appel à une personnalité ayant une connaissance approfondie de la surveillance. Vous êtes au bénéfice d'une formation universitaire adéquate (droit, gestion, audit ou équivalent) et avez au moins huit ans d'expérience professionnelle dans une fonction similaire. Outre votre maîtrise du français, vous avez également de très bonnes connaissances de l'anglais. Opportunités Haut degré d'autonomie, développement de l’organisme de surveillance AOOS, lieu de travail au centre de Genève. Entrée en fonction en juin 2026 ou à convenir. Contact Etes-vous intéressée ? Merci de nous soumettre votre dossier de candidature complet sur ce site. Seules les demandes directes sont prises en considération. Pour de plus amples informations n'hésitez pas à contacter Ralph Frey (en allemand ou anglais) au 044 215 98 89, ou Roberta Poretti Schlichting (en français) au 0919119871. Clausiusstrasse 50 8006 Zürich",On-site,2026-04-19T02:00:10+02:00,https://www.jobs.ch/en/vacancies/detail/bf581cc3-f850-465e-8f09-3851a6950018/,bf581cc3-f850-465e-8f09-3851a6950018
Finance/Trusts/Real Estate,101,Comptable,Accès Personnel SA,1227 Les Acacias,,"Pour notre client à Genève, nous recherchons un(e) Comptable Autonome, précis(e) et désireux(se) de mettre à profit vos compétences techniques et votre rigueur, vous intégrerez une équipe compétente et stable afin d'accompagner le service comptabilité. Votre mission : Tenue de la comptabilité Etablissement des bouclements trimestriels Contrôle des factures fournisseurs Rapprochements et déclarations de TVA Contrôle des factures clients et des écritures bancaires Gestion des devises/taux de change Calcul des impôts ICC et IFD Renseignement de formulaires administratifs Votre profil : Formation en comptabilité (Brevet fédéral ou équivalent) Expérience de 5 ans minimum à un poste équivalent et dans un environnement multi-sociétés en Suisse Excellente connaissance des ERP comptables (Abacus Finance idéalement) et des solutions e-banking De langue maternelle française Allemand B2 (bonne maîtrise du Suisse allemand est un atout) Forte orientation solutions avec une bonne gestion des priorités Sens aigu de la confidentialité et de la précision Rigoureux(se), autonome, flexible et organisé(e) Esprit d’équipe Taux d’activité : 100% (40 heures de travail hebdomadaire du lundi au vendredi, horaires flexibles - vacances 5 semaines/ an - 6 semaines pour les +50 ans) Entrée en fonction : Immédiate ou à convenir",On-site,2026-04-19T02:00:10+02:00,https://www.jobs.ch/en/vacancies/detail/833420c3-a9f8-4893-a94a-8fcce16ceca1/,833420c3-a9f8-4893-a94a-8fcce16ceca1
Finance/Trusts/Real Estate,101,Comptable – Anglais courant | Soft Commodities | Mission temporaire (remplacement maladie),Accès Personnel SA,1227 Les Acacias,,"Dans le cadre d’un remplacement pour arrêt maladie, nous recherchons un(e) Comptable disponible immédiatement. Vos missions : Tenue de la comptabilité générale et auxiliaire Suivi des opérations liées aux soft commodities (matières premières agricoles) Réconciliations bancaires et contrôle des flux Participation aux clôtures mensuelles Coordination avec les équipes internes et partenaires internationaux Profil recherché : Formation en comptabilité (CFC, Bachelor ou équivalent) Expérience en comptabilité, idéalement dans le secteur des matières premières Bonne compréhension des soft commodities Anglais courant (oral et écrit indispensable) Rigueur, autonomie et capacité d’adaptation rapide Conditions : Mission temporaire (remplacement maladie) Début : ASAP 15 Rue Eugène Marziano 1227 Acacias",On-site,2026-04-19T02:00:10+02:00,https://www.jobs.ch/en/vacancies/detail/4ef079c4-c7c0-43a5-bfd8-d89e4d2ea4fe/,4ef079c4-c7c0-43a5-bfd8-d89e4d2ea4fe
Finance/Trusts/Real Estate,101,un·e Comptable,Berney Associés SA,Genève,,"Berney Associés est l’un des principaux cabinets d’audit, de fiscalité et de conseil en Suisse romande. Grâce à notre approche personnalisée, nous développons une relation de confiance avec nos client·es pour les guider vers la réussite de leurs affaires privées et professionnelles. Nous rejoindre, c’est intégrer une équipe de 180 professionnel·le·s motivé·e·s, performant·e·s et toujours à la recherche de nouveaux défis. Envie de voir plus grand ? Nous recrutons pour une entrée immédiate ou à convenir, pour notre bureau de Genève, un·e Comptable Votre mission Vous serez amené·e à accomplir les tâches suivantes pour le compte de nos clients : Gérer et développer un portefeuille clients varié, avec une vraie relation de proximité. Prendre en charge la comptabilité de A à Z : tenue, revue et bouclement, tant au sein de nos bureaux que chez les clients. Préparer les comptes annuels, états financiers et reporting. Accompagner et conseiller les clients sur leurs enjeux comptables et financiers. Établir les déclarations fiscales (PM) et décomptes TVA. Gérer les salaires et charges sociales pour le compte de nos clients. Votre profil Brevet fédéral de spécialiste en finance et comptabilité. Minimum 3-4 ans d'expérience professionnelle au sein d’une fiduciaire en suisse. Sens de l’organisation, des responsabilités et aisance dans les relations avec les clients. Capable de travailler de manière autonome, polyvalent·e, organisé·e et sachant prendre des initiatives. Notre offre 5 semaines de vacances. Temps de travail annualisé, 40 heures hebdomadaires. Possibilité de formation et de développement internes. Une culture de travail positive et motivante où la collaboration et l’initiative sont encouragées. Favoriser la pratique du sport (participation financière). Entreprise dynamique qui investit dans les nouvelles technologies (digitalisation). Nous vous offrons l’opportunité d’intégrer un groupe en pleine croissance et aux domaines d’intervention variés. Chez Berney Associés, nous valorisons les compétences, soutenons la formation continue et encourageons le partage d’expérience entre nos collaborateur·trice·s pour créer un univers de travail basé sur la transmission et l’esprit familial. Envie de nous rejoindre ? Nous nous réjouissons de recevoir votre candidature ! Berney Associés s’engage à recruter dans le respect de l’égalité des chances. Nous tâchons de créer un environnement de travail équitable et inclusif, où toutes les décisions relatives au recrutement sont exemptes de discrimination. 8, rue du Nant 1207 Genève",On-site,2026-04-19T02:00:10+02:00,https://www.jobs.ch/en/vacancies/detail/a014c0c4-200c-492e-b7e1-d43577fae7bc/,a014c0c4-200c-492e-b7e1-d43577fae7bc
Finance/Trusts/Real Estate,101,Technicien à 100%,Comptoir Immobilier SA,Genève,CHF 54399 - 94399 (jobs.ch estimate),"Le Groupe Comptoir Immobilier est un leader dans le domaine des services immobiliers dont les origines remontent à 1825. Animé d’une culture à caractère familial et humain, nous comptons aujourd’hui plus de 380 collaborateurs répartis entre le siège à Genève et les différentes agences implantées dans les cantons de Vaud et Valais. Forts de notre expérience et de notre savoir-faire, nous proposons une gamme complète de services tels que la gérance, l’administration de PPE, la vente et estimation de tout type de biens, le pilotage de promotions et de projets architecturaux, les rénovations, ainsi que l’immobilier commercial et d’investissement. Professionnalisme, performance, sens du service et qualité de conseil constituent le fondement de nos valeurs, alliés à notre engagement en faveur du développement durable ainsi que à notre éthique fondée sur des relations de respect et de loyauté, gage de de notre réussite. Reconnu entreprise formatrice, le Comptoir Immobilier s’engage également à offrir à ses collaborateurs un environnement de travail stimulant et collaboratif en valorisant les compétences de chacun. Si vous vous identifiez à notre groupe, n’attendez plus : rejoignez-nous ! Pour notre siège à Genève, nous recherchons aujourd'hui un : Technicien à 100% Vos principales responsabilités : Gestion technique complète d'un portefeuille immobilier de clients privés ; Réalisation des états des lieux d'entrées, préliminaires et sorties ; Organisation et suivi des travaux ; Constat et suivi des sinistres ; Conclusion, renégociation et suivi des contrats d’entretien ; Veille au bon fonctionnement des installations techniques des immeubles ; Demande de devis et contrôle des factures ; Contact avec les locataires, les propriétaires, les autorités, les entreprises et les concierges. Votre profil : CFC d’employé du bâtiment ou d'employé de commerce, idéalement en régie, ou équivalent ; Excellentes connaissances techniques du bâtiment ; Première expérience réussie d’au moins 5 ans dans un poste similaire en Suisse ; Maîtrise des outils informatiques usuels, Quorum un atout ; Personnalité agréable, méthodique, dynamique et proactive ; Aisance relationnelle, sens des priorités et du service client ; Suisse ou au bénéfice d’un permis valable. Nous offrons : L’opportunité de rejoindre une grande société familiale en plein développement ; Un environnement dynamique touchant aux différents métiers de l’immobilier ; Un cadre de travail agréable et proche de toutes les commodités ; Une rémunération attractive correspondant à vos compétences et performances ; 5 semaines de vacances ; Horaires flexibles ; Lieu de travail en centre-ville de Genève. Entrée : à convenir Loyauté, performance, dynamisme et élégance sont les qualités d’esprit qui animent l’ensemble de nos collaborateurs. Si vous partagez également ces valeurs, nous serons ravis de découvrir votre dossier de candidature complet (CV, lettre de motivation, certificats de travail, diplômes) via JobUp uniquement. Dans ce document, le genre masculin est utilisé comme générique dans le seul but de ne pas alourdir le texte. Discrétion assurée. Seules les candidatures correspondant au profil recevront réponse. Cours de Rive 7 - Case postale 3753 1211 GENEVE 3",On-site,2026-04-19T02:00:10+02:00,https://www.jobs.ch/en/vacancies/detail/6c88ad14-3639-4d80-b9fc-ea05acf981ec/,6c88ad14-3639-4d80-b9fc-ea05acf981ec
Finance/Trusts/Real Estate,101,Comptable Expérimenté,Fed Group,Lausanne,,"Fondé en 2001, le cabinet Fed Finance est spécialiste du recrutement intérimaire et permanent pour les métiers de la comptabilité et de la finance. Nos consultants sont tous des experts et parlent votre langue. Nous nous engageons à vos côtés pour vous accompagner tout au long de votre recherche d'emploi et à chaque étape de votre carrière. Présents en Suisse, France, Canada, Espagne , Portugal, UK, Belgique et Cote d'Ivoire, nous sommes là pour vous accompagner. Comptable Expérimenté Nous sommes à la recherche d'un Comptable Expérimenté pour le compte de notre client, grande entreprise industrielle implantée dans le tissu local. Vos missions dans les grandes lignes : - Gestion intégrale de la comptabilité pour vos entités. - Élaboration et analyse des clôtures trimestrielles et annuelles. - Établissement et suivi de la trésorerie, - Gestion des comptes de banques - Etablissement des rapports financiers et budgets prévisionnels - Suivi des factures clients et fournisseurs - Préparation des déclarations de TVA - Interlocuteur des différentes parties prenantes - Amélioration des processus de contrôles internes Nous cherchons une personne avec: - Expérience confirmée en comptabilité dans une société industrielle idéalement - Bonne maitrise des outils - Capacité à travailler en autonomie sur son poste J'attends votre candidature. Quai de l'Ile 13 1204 Lausanne",On-site,2026-04-19T02:00:10+02:00,https://www.jobs.ch/en/vacancies/detail/3b9f30e5-fdfb-4dde-8860-f813bbde1618/,3b9f30e5-fdfb-4dde-8860-f813bbde1618
